{
  "$schema":"https://json-schema.org/draft/2020-12/schema","$id":"https://ubuddy.invalid/schemas/cp-rir-d2-cross-sink-escrow-v0.json","type":"object","additionalProperties":false,
  "required":["$schema","schemaVersion","status","caseAlias","observedTick","contract","globalSafety","sinks","effects","escrow","runtimeStatus","utilityStatus","causalScope","implementationStatus"],
  "properties":{"$schema":{"const":"ubuddy-cp-rir-d2-cross-sink-escrow-v0.schema.json"},"schemaVersion":{"const":"cp-rir/d2-cross-sink-escrow/v0"},"status":{"const":"illustrative_v0_draft"},"caseAlias":{"type":"string","minLength":1},"observedTick":{"type":"integer","minimum":0},"contract":{"type":"object","additionalProperties":false,"required":["allOrNoneClaim","historicalViolationErasure"],"properties":{"allOrNoneClaim":{"const":"HYPOTHESIS_NOT_VERIFIED"},"historicalViolationErasure":{"const":"FORBIDDEN"}}},"globalSafety":{"const":"HARD_VIOLATION_UNVERIFIED"},"sinks":{"type":"array","minItems":2,"items":{"type":"object","additionalProperties":false,"required":["sinkId","resourceId","ownerId","epoch","versionBefore","versionAfter","effectReality"],"properties":{"sinkId":{"type":"string","minLength":1},"resourceId":{"type":"string","minLength":1},"ownerId":{"type":"string","minLength":1},"epoch":{"type":"integer","minimum":0},"versionBefore":{"type":"integer","minimum":0},"versionAfter":{"type":"integer","minimum":0},"effectReality":{"enum":["APPLIED_DECLARED","ABSENT_DECLARED","UNKNOWN_UNVERIFIED"]}}}},"effects":{"type":"array","minItems":2,"items":{"type":"object","additionalProperties":false,"required":["effectId","sinkId","versionDelta","epoch"],"properties":{"effectId":{"type":"string","minLength":1},"sinkId":{"type":"string","minLength":1},"versionDelta":{"type":"integer","minimum":0},"epoch":{"type":"integer","minimum":0}}}},"escrow":{"type":"object","additionalProperties":false,"required":["reservationId","state","ownerId","expiry","reclaimStatus","capacity","reservedUnits"],"properties":{"reservationId":{"type":"string","minLength":1},"state":{"enum":["RESERVED_UNVERIFIED","PARTIALLY_COMMITTED_UNVERIFIED","RELEASED_UNVERIFIED","UNKNOWN_UNVERIFIED"]},"ownerId":{"type":"string","minLength":1},"expiry":{"type":"integer","minimum":0},"reclaimStatus":{"enum":["NOT_IMPLEMENTED","PENDING_UNVERIFIED","RECLAIMED_UNVERIFIED"]},"capacity":{"type":"integer","minimum":1},"reservedUnits":{"type":"integer","minimum":0}}},"runtimeStatus":{"const":"UNKNOWN_INPUT_NOT_PROVEN"},"utilityStatus":{"const":"NOT_EVALUATED"},"causalScope":{"const":"NOT_EVALUATED"},"implementationStatus":{"const":"planned/unverified"}}
}
